"reviewId","appVersion","score","at","content"
"368f986f-dd6a-4f10-b5c3-1710b4242f2f","2.14.1","2","2024-10-24 07:29:15","Les voix son comportement décalé parapore a l'image et sa fait plusieurs semaines que sa le fait."
"ee9c1882-74f2-436b-b3da-02d26066bbe4","2.14.1","5","2024-10-24 01:38:58","J'adore"
"cdf74492-089c-416a-948c-a7c52c6286fe","2.14.1","1","2024-10-23 21:34:10","Il manque tous les derniers épisodes de l'amour est dans le pré ..."
"d5c49abd-f5ef-4b91-a0cf-97315728e076","2.14.1","5","2024-10-23 07:12:04","étant en panne de télé cz dépanne bien"
"1bc6c3e7-f1cc-4785-9739-94eb43468a7b","","4","2024-10-22 22:58:13","L'application est super mais ya des bug des fois je bug est du coup je peut jamais étre en direct"
"8882190a-c5fc-4200-abf4-c0a0fe9b48c4","2.14.1","5","2024-10-22 21:26:15","mieux que la popop qui beugue mais beugue p'tin"
"04fd5038-3e1f-4545-9fd2-3f471a930dd2","2.14.1","1","2024-10-22 14:12:47","Des replays qui ont des beugs sans arrêt c'est pénible. Les pubs durent trop longtemps et se bloquent à la fin donc impossible d'accéder aux épisodes"
"273cb6ed-0ce4-42f4-8f4c-8c48433d0964","2.14.1","1","2024-10-22 11:07:35","Rebeug 😔uniquement son puis ça beugue .... vraiment déçu"
"e0c1fb1d-4aeb-4991-ad1e-dc4473028371","2.14.1","5","2024-10-22 07:23:01","excellente application pour l itinérance avec un contrat en data illimitées. j apprécie et approuve."
"cd4eae09-354d-4f9e-9088-18014979ecfe","2.14.1","2","2024-10-21 21:32:44","Trop de pubs pour lire une émission en Replay. Il y a 4 pubs interminables, qui ne donnent qu'une seule envie, de quitter l'application."
"b7b0290e-2c6d-42b2-a33f-bfa1e1c96d2d","","1","2024-10-21 21:20:18","Malgré plusieurs installations, seul un écran figé apparaît après avoir rentré mes identifiants... (Galaxy Note 20 Ultra 512) Auparavant chez Orange la plupart des applications beugguaient, et maintenant Free s'y met aussi..."
"f03b9344-a8e4-45be-ac78-cbc78af6e8c3","2.14.1","5","2024-10-21 16:48:06","très ravis de cette application avec ma p'tite amie , fonctionne parfaitement bien"
"cc01b40b-b9f8-4075-b2e5-8d33fbc6d71a","2.14.1","1","2024-10-21 16:40:33","L'appli fonctionne bien mais aborde ÉNORMÉMENT de flux de données et il est impossible de réduire cette consommation. Pour encore, zen VOD, l'appli affiche pas moins de 2 à 3 séries de 5 à 7 publicités (donc une vingtaine) irréductibles mais le pire est que ces pub sont en définition Ultra et qui ralentissent le système à un point tel qu'on passe plus de temps à attendre la fin su ralentissement qu’à visionner le film lui-même. Application inutilisable."
"ae1f1d32-c239-48a1-baad-eb4df75277ec","2.14.1","1","2024-10-21 14:33:10","Trop de pub"
"24a62fff-3293-4116-89d6-16b6e28d79cf","2.14.1","5","2024-10-21 12:30:00","sympas"
"fd236ac2-7198-4367-93f6-604e7951ea2c","2.14.1","4","2024-10-21 09:35:54","bon programme facile à s'en servir"
"846c98d3-85d5-49ce-b7e5-ff9bdbf12de0","2.14.1","5","2024-10-21 08:51:37","très intérésant"
"b40921d8-5e2b-4d8a-901f-a36de450a176","2.14.1","3","2024-10-20 20:59:56","Perfectible. Souvent des messages d'erreur avec un arrêt de l'image..."
"01348282-4393-4fad-b4fc-885b44730b28","2.14.1","1","2024-10-20 20:35:17","rien c'est nul"
"0e5c3112-3554-432d-bd6a-5e37893be994","2.14.1","3","2024-10-20 20:09:54","Pourquoi quand je tourne l écran sa rame ,tous le temps des coupure . Cordialement."
"9065ebd4-974d-46d4-b23a-045cdb8beaca","2.14.1","5","2024-10-20 19:45:31","Suis déçue 😞 car ma 2 eme tel installé avec un nouveau décodeur n arrête pas de beuguer! Et appeler chaque fois free .. mais le personnel est top !"
"8369aee3-b6da-4c92-9f91-c45779455188","2.14.1","2","2024-10-20 14:39:43","On ne peut pas mettre de favoris. On ne peut pas sauvegarder ou enregistrer des séries. Il faut refaire ses recherches complètes, c'est dommage qu'on ne puisse pas faire les recherches par titre et qu'on doive tout défiler pour arriver enfin à la serie qu'on souhaite."
"276a56f2-5270-497d-9293-7a980d94b815","2.14.1","5","2024-10-20 13:32:40","très bonne application !"
"37e15195-9ae9-4f1f-bfc8-db36ed5ec74c","2.14.1","5","2024-10-20 13:01:48","j'aime cette application car je peux regarder la télé sur mon télephone même si je suis hors de chez moi c'est très bien Renee jacquet"
"49b4a9e6-0205-4721-bfb1-fb3ec8704e37","2.14.1","5","2024-10-20 11:34:49","Super cette appli de Free pour regarder toutes les chaînes de la FREEBOX. Encore une innovation de FREE"
"77d76add-ec00-430b-a383-58184f424061","","5","2024-10-20 10:07:42","C très bien ,tu peux avoir des anciennes émission qu'on peut pas trouver sur les autres plateformes."
"089c1f49-a608-4fb4-8b72-f01964b8f591","2.14.1","2","2024-10-20 04:15:28","J'ai passé mon abonnement téléphone chez Free il y a peu en pensant que l'appli, qui est excellente en soi, fonctionne en Suisse à moins de 100m de la frontière française....ben non. Elle détecte que je suis sur le Wi-Fi de mon lieu de travail et me colle un Erreur dash#1600...contenu non disponible dans votre zone géographique. Cette saleté détecte aussi les vpn apparemment. Du coup, je pense retourner bientôt chez mon ancien fournisseur ou l'appli télé ne faisait pas autant de misères."
"8f6552d2-5390-4193-9370-b1724f10fcd0","2.14.1","4","2024-10-19 23:29:41","rien à redire !!👍 merci beaucoup."
"baa2d368-5934-4c1d-9b43-885bf50eae68","2.14.1","5","2024-10-19 18:10:21","une application pratique"
"372e9734-d74a-47c6-85ce-cd74493d8046","2.14.1","2","2024-10-19 07:27:16","Bonne application dommage quand on regarde une série où documentaire réelle en Replay rien ne signale que l'on là vue. Idée pour la prochaine MAJ"
"2b341e71-03b6-4d8b-8ab3-c94e3f6d582e","2.14.1","1","2024-10-18 22:51:22","Depuis la freebox ou casté depuis mon telephone il est très difficile de regarder un replay sans avoir des coupures toutes les 2 à 3 mins comme si ca chargeait le film pendant 3 à 45 secondes - la première demi heure se passe sans problème-. Je précise que je suis en fibre avec une freebox revolution. J’ai eu aussi 2 fois une erreur dash_error_http_18_0 et bien sûr devoir se retaper toutes les pubs à chaque fois pour revenir à l’endroit où ça a coupé !"
"7fe32d41-0cf1-4534-aecf-82f5fe12efd3","2.14.1","4","2024-10-18 20:51:38","c'était très bien à regarder et se connecter à la télé pour pour moi très très bien"
"6e7d7791-3a38-4791-986e-c24d38781971","2.14.1","5","2024-10-18 20:42:38","Facile pratique"
"d5631cea-6f7a-46b7-b29b-378aeafae704","2.13.1","5","2024-10-18 19:49:55","appli génial"
"0f6e7ab7-fd6a-4801-9831-07f353b1ab38","2.14.1","5","2024-10-18 17:18:39","👍"
"1e7cfbd3-ecb3-4702-acec-b011acd9e3a2","2.14.1","5","2024-10-18 16:44:16","Choukar"
"09877a1b-4e6b-43e4-aa19-bb199ad4bd64","","5","2024-10-18 16:20:32","C'est super !!! D'avoir sur son portable OQEE BY FREE"
"f68116c0-b93c-48c4-904f-e04396f8a596","2.14.1","1","2024-10-18 14:07:23","Je reçois un texto... Votre offre mobile vous donne accès à 230 chaînes TV, téléchargez l'appli. J'installe l'appli, Votre offre mobile ne vous permet pas de profiter de l'application 🤪"
"8d25a796-1a52-4f27-b86f-fa55b76cbb53","2.14.1","4","2024-10-18 09:57:00","J'avais déjà laissé un avis il y a 6 mois où j'expliquais trouver cet appli pratique et très utile mais effectivement comme d'autres utilisateurs j'ai un chromebook et malheureusement quand je suis dessus je ne peux regarder la tv by free, qu'en écran réduit, très très dommage et vivement une correction de ce problème afin de pouvoir profiter pleinement de ce service. Merci bcp ;)"
"0b00f44b-12fc-4680-8db2-903c65222a59","2.13.1","5","2024-10-18 09:51:34","Important"
"fd9eebe5-e406-4156-9650-d8822aa3a78c","2.14.1","1","2024-10-18 07:48:09","Bofff, jamais mise a jour des Replays"
"58ccf16b-a3a6-41d0-96d7-2c12c770c814","2.14.1","4","2024-10-18 05:05:20","Utile , efficace, téléchargement efficace."
"a34fb8e1-2dcd-4e04-bd6d-ac58257cc09a","2.14.1","2","2024-10-17 22:58:30","l'appli ne fonctionne pas correctement depuis 2 jour. Toujours des message d'erreur sur le telephone"
"8187a594-1317-4bdd-bacf-4b1496041162","","1","2024-10-17 22:53:46","pas d arret automatique"
"d643b171-0e94-4a7c-8b4e-4c9066ca038c","2.14.1","5","2024-10-17 22:41:46","|choisir sa chaîne grâce au numéro???"
"5362e037-4789-4d3a-9936-c02b21c8c834","2.14.1","2","2024-10-17 22:14:29","Bug ! Ne peut plus regarder de replay depuis 1 mois, ne se chromcrast plus, ça bug tout le temps... alors qu'avant ça fonctionnait très bien maintenant l'appli est inutilisable"
"4e89deb7-dc9a-4ee0-bb07-c8fcffa5bc78","2.14.1","3","2024-10-17 16:27:54","J'ai changé la résolution de l'image,et ,tout est revenu normal."
"714d83d7-0be0-4659-98ee-0e862d002bb0","","5","2024-10-17 16:25:43","super génial"
"cb0517b4-3bd4-4b69-b91c-269a866e86be","","1","2024-10-17 15:50:14","Pubs pubs pubs.......... impossible de regarder quoi que ce soit ... nul!!"
"5e8bfa39-55c3-4710-9378-baa6175f4dd3","2.13.1","5","2024-10-17 13:13:23","Très bonne application je recommande"
"ad1a474d-7d46-4bf3-ac42-cb10b4aaa5ef","2.13.1","4","2024-10-17 08:57:39","super Application"
"a3d83bad-481f-46b2-9078-6d7116cc6fce","2.14.1","1","2024-10-16 21:06:31","Nul"
"e883a297-7932-4614-bc29-04c3a5697cc5","2.14.1","5","2024-10-16 12:20:46","Très bonne application, intéressante, permet à 12 h et 19 h d'avoir les actualités régionales. J' ai tout de même un problème à régler, sur une vieille TV, avec une prise TV wifi peut être trop vieille, je n' arrive pas à installer l'application, cela me dit indisponible. Je réfléchis pour trouver la solution."
"ff4ac4a6-53a1-4822-a300-1e3cad2a0366","2.14.1","2","2024-10-16 11:09:12","Mises à jour impossible"
"d462cb86-9168-4824-8dbb-7ba045217a72","2.13.1","5","2024-10-15 22:31:36","Merci Free !"
"c4ad7d07-01ec-497a-b54e-17b16921b219","2.13.1","5","2024-10-15 21:41:09","Bonne appli ne bugue jamais à chaque fois que je l'utilise. Le seul truc un peu chiant c'est à l'ouverture, l'app nous conseil le visionnage de chaîne. Inutile pour ma part..."
"1eb762c7-1fa5-43f7-a05a-41881c514c30","2.13.1","5","2024-10-15 20:58:53","Étand abonné Forfait mobile 5G je suis ravit de pouvoir profité du service TV 😃 Merci FREE !!! 👍"
"714d5963-79b9-4261-a313-a08020decec7","2.14.1","5","2024-10-15 20:41:41","Au top !!!"
"0da96c23-da03-428a-b4c5-b5d60c08af35","2.13.1","5","2024-10-15 20:31:03","Très bien !"
"85be2274-25e4-4070-b39d-73cd2ea9e013","1.19.1","1","2024-10-15 19:37:54","Qualité d'image en Replay et catastrophique sur Android TV 4k j'ai l'impression d'un retour dans les années 80 par contre pour la pub là il y a aucun problème la qualité et nikel et me dites pas que c'est ma connexion mon débit et au max se que la révolution peut donner et j'utilise pas la WiFi"
"da7b4b26-eb09-4ce4-9d2f-2f93df0499e0","2.13.1","2","2024-10-14 21:02:21","les images sont au ralenti"
"2fe64715-fd26-4b2b-adb2-bc40b9948fd4","2.13.1","2","2024-10-14 21:02:02","Pas top sur Android TV. Impossible de revenir sur l'écran du menu, obligée de tout redémarrer régulièrement. Donc obligée de passer la box et de multiplier les télécommandes. Pénible Complément du 14/10/2024 : l'appli plante. Au démarrage tourne en rond sans jamais se connecter. Si par miracle l'appli démarre, l'image de fige au bout de 10 s et l'erreur #1350 s'affiche. Appli désinstallée et réinstallée ne change rien"
"4bb26a5a-f64a-4a79-8a33-25ac84faa760","2.13.1","1","2024-10-14 17:30:08","Connexion impossible"
"2d31d963-1636-4e40-a757-b99d31bba6d0","2.13.1","1","2024-10-14 12:07:32","free des voleurs comme les autres et pas envie de perdre mon temps avec des robots et des réponses toute faite il a rien compris il est passer chez free ou fric à vous de voir"
"038d2d5a-3804-46e0-b559-6e10c8885d9f","2.13.1","1","2024-10-13 21:12:37","Cette appliquaction bug pas.moyen de regarder qq chose dessus"
"1392ed44-09fa-4f17-95a2-1ff0cf9ec23e","2.13.1","1","2024-10-13 16:24:02","Gros bug, fait que de couper autant sur un mobile que sur un pc au niveau des replayd"
"f3e5f937-c4cf-42db-be2a-645c64b7c7d8","2.13.1","5","2024-10-13 14:39:10","Trop cool voix la télé sur téléphone"
"ca6915b9-c1ad-4101-92c8-c9e6859ed47a","2.13.1","1","2024-10-13 02:01:11","Plante régulièrement"
"b93f76a5-03c9-4b8e-b443-241c2755d794","2.13.1","5","2024-10-12 22:59:47","rien à dire c'est vraiment le top."
"a1dfd751-0ad9-447d-abdb-858e78ddf436","2.13.1","5","2024-10-12 15:37:05","C'est génial"
"70124d9a-a7f9-4c8f-8ce1-ab28a2ed3778","2.13.1","1","2024-10-12 15:12:22","Non conforme avec le Replay de la box. Je trouve ça inadmissible que l'on ne puisse pas regarder tous les Replay sur l'application de téléphone comme celle de la box. Même si l'on saisie le bon intitulé de la série ou du film que l'on a commencé a suivre sur la box, on ne peut pas toujours le suivre sur l'application téléphone."
"a1568b8f-6100-46ea-b174-3f9196045bee","2.11.1","5","2024-10-12 14:42:17","Très bien 👍🏻"
"b7ba4c11-3fba-4981-bc51-2ef8fb001849","2.13.1","5","2024-10-12 14:25:39","parfait"
"b8b83407-6670-4660-a8e5-996c4b3096be","2.13.1","5","2024-10-12 00:17:53","Très bien"
"895b09e6-976a-42aa-b1fd-f82de7438a02","2.13.1","2","2024-10-11 16:50:27","Cette application est une catastrophe, aussi bien sur smartphone que sur notre TV , des chaîne avec écran qui sont vert sa bug au moins 2/3 fois par jour."
"bb3566b3-efd7-4598-a326-8477ed8295e3","2.13.1","3","2024-10-11 13:01:55","Certains replay ralentissent"
"a5bf9999-1bef-4d9e-a510-24e2f774f080","2.13.1","1","2024-10-11 12:48:56","trop de pub les mêmes pub passe 3 fois avant que le programme recommence"
"c66b3fb9-79b7-41f5-834a-f64606be4892","2.13.1","1","2024-10-11 08:44:31","inutile"
"860f3964-a058-495e-9336-bf7a14f91255","2.13.1","5","2024-10-10 18:27:26","L'application oqee by free est bien, mais les transmissions fibres de free laissent à désirer. On ne peut pas dire... merci free!!!"
"f55482dc-c6d1-4913-8a13-6c8b01331ee1","2.13.1","1","2024-10-10 16:52:04","pas de son sur chaîne bfm"
"6ef7efd6-7f9f-45da-ac75-12134828b5d8","2.13.1","1","2024-10-10 16:37:53","Je n'arrive plus à avoir les programmes"
"2120d6d6-dd4e-4eb0-9a8c-651dd0a72a1b","2.13.1","5","2024-10-10 13:50:11","superbe application pour les abonnés FREE"
"1705f40b-b76f-49e2-8a06-2eeba1d3fa34","2.13.1","5","2024-10-10 12:13:58","super"
"bea2c7ac-f439-4276-bbee-b125f7bec07d","2.13.1","1","2024-10-10 08:43:21","Nul, changement de chaine trop compliqué"
"4f3cf86d-45fd-4855-8d52-2ee0bdf96005","2.13.1","1","2024-10-10 08:12:50","Gros pb de beug sur les replay : les pubs d'avant programme saccadent énormément et se bloquent : lancer un replay devient fastidieux. Dommage sinon le reste est plutôt bien. A corriger urgement !!!! Svp"
"c3c372ec-1309-4126-aaea-487f74ff9cde","2.13.1","5","2024-10-10 07:14:20","Bonne application"
"db2c9948-b923-4ac1-8e82-e29aa077627e","2.11.1","5","2024-10-10 05:49:15","hyper pratique, tv en live et en différé, replay, tout y est!!!"
"2cdc1ce2-67c5-41cd-b3ec-136bfe46378e","","5","2024-10-09 22:33:21","Très bien"
"7a453438-8355-45a6-9446-42c244eded4e","","2","2024-10-09 21:14:51","Ça rame trop"
"03687566-db71-4c42-bfda-f29f495c1fdb","2.13.1","5","2024-10-09 20:41:03","très bonne application 👍"
"6b8451b6-a870-46b1-a718-d4600b223182","","1","2024-10-09 14:07:39","Ça vaut rien du tout surtout ne pas installer"
"4a908803-fba6-41f8-b4ce-3950e9e3403c","2.13.1","4","2024-10-09 08:38:03","Quelques bugs qui coupe régulièrement l'application sur ma Miibox... Dommage, les autres applications pas de soucis."
"8640ec34-494e-4556-89ab-cfe88a19e2e6","2.13.1","5","2024-10-08 23:00:08","Super. Merci free"
"4dc803a2-e197-4ed8-8320-10b01efbf055","2.13.1","2","2024-10-08 20:55:24","Les chaines du groupe canal non disponible depuis aujourdh'hui !!!! Deja elles etaient pas dispo a l'accueil, comme c'est bizzarre....."
"70681643-3b2c-43b0-900d-13501d483a40","2.13.1","5","2024-10-08 19:29:15","j'adore, trop facile à utiliser trop bien 👍"
"87d0b563-6ada-4e9f-af67-12448684ebb9","2.13.1","2","2024-10-08 19:19:18","On aimerait une mosaïque de chaînes en appuyant sur 0, comme sur la Freebox révolution. Et pouvoir revenir sur la chaîne précédente en appuyant sur la flèche retour. S'arrêter sur une image TV, quand on fait pause pour figer une scène, et pas directement un menu opaque."
"e6f2bfcb-e5de-4c00-8fe3-7cf087f4501c","2.13.1","1","2024-10-08 16:02:12","Gros bug sur Android box Tv. Signalé ( demande 39570) j'ai envoyé deux fois le lien vidéo de mon problème. Le technicien me dit avoir envoyé une réponse que j'ai jamais reçu. Il veut clôturer le ticket alors que j'ai toujours le problème. J'ai l'impression d'avoir affaire à un robot ? Bref le bug existe toujours...... Ça serait bien de lire les mails !!!!"
"b02aba0d-3c0f-4947-a2cf-084f2f3882e9","2.13.1","5","2024-10-08 11:05:05","J'aime"
"be9a5d47-a4f6-48f0-94c3-00316e14dae4","2.13.1","5","2024-10-08 10:22:08","Bonjour, pratique pour les voyages, on dit merci qui ! Merci Free !!"
"541b1d95-8383-483a-b7fb-7265c1efe997","2.12.1","5","2024-10-08 08:44:17","Je recommande application bien réalisée et simple à utiliser"
"bd254bf3-6935-4f94-b3df-231fb6b3ca18","2.13.1","3","2024-10-07 19:02:36","App très intéressante, dommage qu'on ne puisse pas filtrer les application gratuites des applications payantes ou demandant un abonnement."
"a68cb8df-ebf9-48da-8959-d41039657bc1","2.13.1","3","2024-10-07 16:20:52","Mis à part les pubs qui lag à mort au point de finir par regarder autre chose ...ça va."
"63c0b54e-f4bc-4fde-9cf6-c092e9fdf771","2.13.1","5","2024-10-07 15:02:57","très bien 👍🏼"
"4d44497d-08d3-472a-836a-09b3da924c96","2.13.1","1","2024-10-07 14:14:41","Connection impossible dans le salon Réfléchi à changer de opérateur"
"e4bc1319-0063-4f7d-9f33-23dc09a3890d","2.13.1","4","2024-10-07 12:50:50","Errore dash #1116 quand je tourne mon téléphone en mode verticale , le problème est résolue pour moi en faisant une manipulation simple allez dans paramètres de l'application + en cliquant sur le petit bonhomme en haut a droite ) ensuite descendez jusqu'à règlage vidéo ensuite cocher forcer l'utilisation de widevine L3 im Happy now"
"bf934eae-ad56-4097-91fa-eb5c94253017","2.13.1","2","2024-10-07 10:58:14","Depuis 2 semaines, Oqee ne fonctionne plus avec mon smartphone. Je l'ai désinstallé et réinstallé, ça ne marche toujours pas."
"0e9a9df5-1132-4ab1-8bb6-1c73d1510373","2.13.1","5","2024-10-07 08:40:19","Maintenant c'est bien 😉🎭"
"6be4ca80-24cb-48ef-a0e3-599488eace37","2.12.1","5","2024-10-06 20:41:57","génial !!"
"363b3ac0-a54d-44c5-8050-884f4429764a","2.13.1","5","2024-10-06 19:03:51","J aimerais bien"
"da1e3690-87ac-40ef-8598-a808c22a5876","2.13.1","5","2024-10-06 17:37:36","vraiment super ! tellement rare une application qui ne présente aucun défaut !!! et pourtant je suis très exigeant sur l'ergonomie et l'efficacité. Bravo !"
"b5595b46-6bd1-4761-9a64-6ab128d3f277","2.12.1","5","2024-10-06 15:57:57","très bonne application"
"8fec3f77-bc11-4266-84db-114af0201fa4","2.13.1","5","2024-10-06 09:43:45","même tf1 gratuit et tout le reste. merci free qui a aidé les autre opérateurs à aligner leur prix..."
"8cd5b19f-c64e-4757-971d-493f322fdc3f","2.13.1","5","2024-10-06 09:07:09","bonne application et il y a beaucoup de chaînes."
"25f267bc-f062-4503-b4a8-922fe9b08d76","2.13.1","5","2024-10-05 21:57:59","Application très pratique et facile à utilisé"
"e215bdac-5814-467e-b170-fcadbc52db7d","2.13.1","5","2024-10-05 21:09:07","La meilleure application TV, comparé avec les autres fournisseurs internet. Mes critiques négatives, objective jadis, ont eu écho😀👌 Maintenant vous êtes les meilleurs 💪"
"69871f8c-9b42-482e-a5df-67aaacd69385","2.13.1","5","2024-10-05 10:55:07","M'ouvre une porte que je ne connaissais pas. Très facile d'utilisation. Je recommande"
"295cb04a-2138-4f42-96ed-ceacf97c6afd","2.13.1","5","2024-10-05 10:11:36","Simple, pratique et de très bonne qualité."
"9b95a103-b36a-461a-a7a4-087f01409a3f","2.11.1","5","2024-10-05 08:40:06","c’est trop bien"
"3b0f96e5-6f7b-4df8-b2d7-47fe30a9c1aa","2.13.1","5","2024-10-04 16:43:07","Ok. RAS"
"44428a0a-89cc-46a5-a389-1550038e0cd3","2.13.1","4","2024-10-04 14:25:39","baucoup de decrochage"
"8e4d6840-2f47-46ad-ad8a-4fc053f2ccdd","2.13.1","5","2024-10-04 14:21:08","Super très bien"
"e313669f-0816-4021-aead-d477437c69b0","2.13.1","2","2024-10-04 14:21:02","Fonctionne approximativement sur TV Android quelques chaînes bug"
"3e3f9bae-cc09-4a67-94ef-dbb4a298e78a","2.13.1","5","2024-10-04 07:51:53","Super pratique, à voir partout, et enregistrement rapide. TOP."
"d49b5d0d-a694-4f80-a20d-b49439538b09","2.13.1","5","2024-10-04 07:48:31","J Aime beaucoup, merci beaucoup à vous tous 🤗💖"
"939a13e8-0fef-48c3-9c2a-ade75a054365","2.13.1","5","2024-10-04 00:59:03","je vis très bonne sensation, je me couche et je regarde des films, des émissions c'est chouette quand même !!!"
"28c02d52-1cdc-4ad6-91e9-5071a8fe7f20","2.13.1","1","2024-10-03 23:26:39","Ne fonctionne plus depuis 2 semaines on paye pour un service qui ne marche pas après vous allez vous plaindre que les gens font de l iptv illégal! Erreur dash 1089 désinstaller vide caché widevine etc rien ne marche tablette Samsung Galaxy tab à smt555 Android 7.1 oui elle date et alors avant ça fonctionnait très bien ."
"81aaf547-6d13-466e-bfec-f865617c07ad","2.13.1","5","2024-10-03 22:45:25","super"
"637d0fa2-962e-4241-8bf6-37984996456b","2.12.1","5","2024-10-03 15:34:46","très bonne application"
"140a419a-b307-4c64-b482-5a027de62c4f","2.11.1","5","2024-10-02 23:19:48","super"
"3d2ff9b6-5272-4712-b246-5565fb634b5e","2.12.1","5","2024-10-02 18:24:29","que du bonheur !"
"ab56def6-34c9-494b-a69c-ddc1851f51cb","2.13.1","1","2024-10-02 17:47:06","Impossible de l'installer sur l'ordinateur. Je quitte Free c'est terminé vos arnaques. Orange sont bien mieux allé salut je désabonne le téléphone et la Freebox"
"bb7792e7-1d40-4dec-bf88-096f1bcd3c78","2.11.1","5","2024-10-02 16:02:18","Idéal quand on est en panne de box. Mais impossible casier sur ma tv"
"ffc0b344-ac58-49e3-a45f-2087320a73de","2.13.1","3","2024-10-02 14:13:29","A quoi sert d'avoir sa propre liste de favoris quand elle n'est pas enregistrée par défaut?? C'est énervant à force de voir apparaître systématiquement la liste totale!!"
"e8a0a1a8-64ab-405c-bd60-622188d811fe","2.12.1","5","2024-10-01 23:05:17","très bien on peu regarder partout"
"ca5e82f4-6a44-48b3-b654-e5f9370df6c1","2.12.1","5","2024-10-01 22:36:00","permet de regarder un programme n importe ou"
"551fc123-e714-43d5-9efa-4e23fdbfdd75","2.11.1","1","2024-10-01 22:18:19","15 quinzaine de pub par film, qualité vidéo nul ! a améliorer !"
"9eedbf97-eb0d-4cb3-91ec-383bf5e6afc8","","5","2024-10-01 14:55:55","tellement pratique"
"64a388be-9c70-4867-9ac0-67fb42a344eb","2.12.1","5","2024-10-01 14:35:38","très bien deux petites fonctionnalités à ajouter et ça sera parfait."
"d54946b6-43ce-493e-ae0b-e7b784eefe93","2.12.1","5","2024-10-01 11:03:48","Trop de pub sinon parfait."
"f0c5d41b-5f3f-4401-bd4a-3e7c554b81a1","2.12.1","3","2024-10-01 06:31:24","Les replays ne fonctionne pas et sont bourrés de Pub!!! Ce qui fait tout buger!"
"fa4610d7-439f-4003-a551-f0af269e5a0f","2.12.1","2","2024-09-30 10:33:35","Je n'ai plus universal + en replay alors que je suis abonné"
"8705ccf6-d889-4130-9c1a-a88079a2ec3f","2.12.1","3","2024-09-30 08:31:24","L'appli ne fonctionne plus depuis 2 semaines!"
"3932a15c-88e8-4782-b86c-4e4010744984","","4","2024-09-30 06:58:22","Une appli dont je me sers au quotidien pour caster sur la télé de ma chambre, avec laquelle je n'ai jamais eu de problème. Depuis hier je n'ai plus les replay des chaînes universal. Elles apparaissent même plus sur la page des chaînes en replay, alors que je peux toujours continuer de bénéficier de ces chaînes en direct. Il en est de même sur la box (delta devialet). C'est bien dommage car j'adore cette appli, donc ce jour je retire une étoile pour m'avoir interrompu une série qui me plaisait."
"df6d5463-66ff-4532-b77f-7dd5d9d3dce0","2.12.1","2","2024-09-29 23:17:02","certaines pubs font bloquer la connexion."
"337ad4aa-ed76-4c49-86c9-e0de417a64d0","2.12.1","5","2024-09-29 22:23:46","J'adore beaucoup free"
"e45523fe-8b7b-4d9c-b9fc-bb9958a679a5","2.12.1","4","2024-09-29 20:03:15","Magnifique Apps gros progrès sur Crashs. Mais gourmand en RAM ? Contrairement à autres Apps tel Arte TV, Orange TV, Netflix, Oqee ne fonctionne pas. Affichage page liste chaînes ok. Mais dès sélection n'importe quelle chaîne alors : Erreur Dash #1121 Erreur DRM. Ok sur autre mobile plus musclé en RAM, sur même réseau🤔 Terminal = Realme C21 / 2go RAM / 32 go dd / Androïd 11 Model RMX3231 processeur octo cœur V. IU Go édition. Interface web muette sans erreur. Néanmoins Merci belle Apps 🙏🏼"
"90160f1e-5932-40b4-bbcb-d95fec687786","","3","2024-09-29 16:56:15","Aucune"
"71b2be25-4cc1-424c-98ee-e2af5831aa4e","2.12.1","5","2024-09-29 10:11:08","beaucoup de choix"
"5e51653c-1d12-4c3d-ad44-309a4cddc226","2.12.1","5","2024-09-29 06:21:13","pratique"
"56540a56-4edb-4a14-812f-d44e9899fd63","2.12.1","1","2024-09-29 01:50:13","Marre des pubs"
"2fa9b69d-40e5-4c33-842d-ea0f90b5307d","2.12.1","1","2024-09-29 00:23:23","Nul, ne fonctionne pas plus de 2 minutes sans crash. Une vrai daube."
"a3b58140-4d3d-4c05-a74b-5c6ac9a5bbc0","2.12.1","1","2024-09-28 21:46:54","Ne fait que bugger !!!"
"493836cb-0be5-4d9a-90f1-0a6bcf066aa8","2.12.1","5","2024-09-28 20:04:58","L'arche niquel"
"8afa7067-7427-47a2-9f4b-b1b8ce41829f","2.12.1","1","2024-09-28 17:32:44","Gros bug sur Android box, ne marche plus du tout !"
