"reviewId","appVersion","score","at","content"
"266e5fd7-5260-4247-9a8c-b44b576012bf","2.5.0","5","2024-05-10 00:51:46","c'est super !"
"031e2e75-2cf0-4746-b32e-382b4b6688ad","2.5.0","2","2024-05-09 23:04:26","Depuis qq jours erreur DRM sur box tv andoid 10. Ecran noir et msg erreur dash. Desintalle et re installe : idem"
"01218c05-53c1-4448-900b-e7ce290209b8","2.3.1","1","2024-05-09 11:49:07","NUL!! Mauvaise interface, chaînes sans possibilité de reculer au début (même pas mettre en pause), bugs, coupures, etc, et ça oui, jamais problème avec la publicité !!!"
"f282d35f-14dc-4388-bec5-fd63e1f61fab","2.5.0","3","2024-05-09 09:56:17","sa va elle est bien la télé 📺 merci ."
"66cf537f-bb75-4d52-a3b3-91f14d87688f","2.5.0","2","2024-05-08 22:57:14","Depuis quelques jours oqee android ne passe plus en plein écran sans bloquer l'image et faire avant arrière en boucle... Inutilisable en l'état en mode horizontal plein écran. Ça marchait très bien avant. Device : Ayn Odin 2 android 13 Pas de soucis sur iphone. Update : je viens de découvrir que c'est quand ma console est connectée à mon iphone (free) en partage de connexion que le bug est présent, si la console est sur mon réseau (free) tout va bien.."
"12e96710-86f7-406d-82c7-f7b5dbdd3481","1.25.3","5","2024-05-08 15:16:38","trop cool"
"6e2d6844-9cb1-4079-9237-d0bf27a7a03f","2.5.0","5","2024-05-08 10:52:57","C'est trop bien de regarder dessin animé j'adore j'adore j'adore"
"ee976717-6291-4a13-a0f0-0448c3201c0c","2.5.0","4","2024-05-08 08:16:05","1 étoile. Ne fonctionne pas avec Freebox 4k. Fonctionne maintenant avec Freebox 4k. 4 étoiles au lieu de 5 car, merci Free de ne pas délaisser une partie de vos clients, pensez à tous quand vous créez une nouveauté."
"09c9f90b-b8bf-40f0-9785-d9157614b34e","2.5.0","5","2024-05-07 23:34:11","c,est super intéressant"
"163a1dde-1132-4427-874f-8c623c89cbd6","2.5.0","2","2024-05-07 21:19:50","Pas top du tout. Fontionne très mal. Trop de bugs"
"98e3b694-054c-414b-baa4-327d5cb12fff","2.5.0","5","2024-05-07 21:07:42","je kiiiiiife cette appli, j'ai pu désinstaller TF1,M6,MOLOTOV et d'autres car on a un accès à un panel de chaînes incroyable 😁😁"
"d70945db-d882-4b22-bbc3-961c2e627cdb","2.5.0","5","2024-05-07 20:50:52","super appli 😊"
"7beeb379-6a3e-42f8-b407-ddf5730a7f02","2.5.0","4","2024-05-07 20:08:54","très très bonne application pour les abonnés... par contre en 5g j'arrive à mettre l'image en paysage mais en wifi sur des connexions différentes, écran noir et pause qui clignote..depuis qqs jours à priori. (wifi fibrés)... si je mets en mode portrait pas de souci ça passe...."
"5cece61f-4024-45d1-b6ee-0dff9634719f","2.5.0","1","2024-05-07 19:37:34","Ne lit plus le contenu des chaînes n'y des enregistrements."
"2b2ecec9-4d6b-4285-8b07-c1a9574112d9","2.4.3","5","2024-05-07 14:04:50","Très très bonne application pour les abonnés"
"b16b6ccb-be27-44b9-b826-ee405e53a973","2.5.0","5","2024-05-07 11:22:52","un seul mot GENIAL"
"c3bf2d87-a995-4cb1-a846-4e04166dd052","2.5.0","5","2024-05-06 23:58:09","Super application , pour regarder nos programmes tv et chaînes préférées partout , à tout moment . C'est tellement pratique et simple à manipuler."
"4f35bdef-72e5-4eb1-8c10-a1c924ce49f6","2.5.0","1","2024-05-06 22:33:14","Déception totale, toutes les erreurs Dash je les connais depuis plus de 15 jours #1189, #1121, #1159...... La liste est longue. Je désinstalle et réinstalle pareil. Tablette Samsung et sur TV même discours... Que ce soit du direct et Replay. 1* par défaut car zéro pas possible."
"c7081bbf-94c1-4bc4-87af-9e9fd952a041","2.5.0","2","2024-05-06 18:50:00","bug"
"baa2421e-0ef8-4b5d-b5b1-034e2e0b53b0","2.5.0","4","2024-05-06 16:53:31","Le Chromecast bug mais sinon ça marche nickel"
"2af77eb3-7dd0-4023-84b4-ddc75259ec44","2.5.0","5","2024-05-06 10:14:04","De loin... de très loin la meilleure application d'opérateur téléphone TV."
"3725aa8c-d91e-4380-a579-484dc33ffece","2.5.0","2","2024-05-06 07:29:14","De gros problème de stabilité avec des pertes d'affichage entre le passage entre le mode portrait et paysage notamment. C'est très agacant"
"1dd29c33-fbdc-4a1f-a098-565aaf8e7108","2.5.0","5","2024-05-06 05:35:51","Très utile permet de suivre ses émissions n'importe où. Fonctionne très bien"
"2d738e0a-6c2d-4855-a5a3-01a91e840239","2.5.0","5","2024-05-06 01:19:48","Le.meilleur opérateur sur le marché"
"8701ca38-a31a-494c-8283-7a677b5305d8","2.5.0","1","2024-05-06 01:02:47","ça s'interrompre tout seul."
"94f6e9a6-7df6-4c51-9332-fb6ad1f4329e","2.5.0","1","2024-05-05 23:54:42","impossible de le mettre en grand écran"
"da8d729c-5398-4741-bb5a-0dca54e0f5ef","2.5.0","4","2024-05-05 22:40:48","Très intéressant !"
"e0de7f62-de3d-49a9-bee0-c1e520f6340f","2.5.0","3","2024-05-05 18:18:33","Certains films sont en anglais,que faire pour mettre en français ?"
"7a2336af-b36b-4fc4-ae11-9211fe538aea","2.5.0","3","2024-05-05 17:11:11","Application quasi parfaite mais il manque plusieurs éléments : pas de PIP comme sur Apple ou la possibilité de contrôler le direct en allant sur les programmes précédents . Plus spécifiquement les catégories des chaînes ne sont pas prises en compte a l'image de M6 qui n'a pas sa catégorie info et société complète. Je suis obligé d'aller chercher dans les derniers replay. Si c'est un programme un peu plus ancien j'aurai du mal a trouver."
"9b6bee7d-472e-4106-8be2-f07fbf821cb1","2.5.0","5","2024-05-05 16:09:32","l'application est super génial merci free"
"6af931ac-f794-4436-a85a-cec651832f04","2.5.0","5","2024-05-05 15:19:43","Très bien facile d'utilisation"
"f6c4ee75-e535-4017-9d42-7a982c849be1","2.5.0","5","2024-05-05 14:56:01","Disponible en continu, en tout lieu, quelque soit le support : tv mobile tablette, ordi... Et aussi à l'étranger avec un vpn !"
"8cd9c7b3-1279-4053-8b98-de1e8bfa7451","2.5.0","3","2024-05-05 14:38:01","Pas très rassurant..... 😡"
"e316b685-b8b6-474b-95ba-52ddb86f5d80","2.5.0","4","2024-05-05 10:55:50","très bien"
"b2f855d3-da87-4d19-bd31-c907d90f94cc","2.5.0","5","2024-05-05 10:49:19","Ne marche plus depuis 10 jours"
"408ac556-ea9d-4619-a636-eb9b497cc809","2.5.0","1","2024-05-05 10:29:22","Bug tout le temp en plein écran ,appli nulle"
"af98b16d-a131-433a-9ec3-fa5aea58f7a9","2.5.0","5","2024-05-05 06:56:32","j adore...ça permet de passer la pub...il ne faut juste pas oublier enregistrement ...hahaha"
"a276edcd-2468-46e0-beb9-82bb179aa699","2.5.0","3","2024-05-04 23:45:29","À quand la fin des beug en cours de visionnage ? C'est trop et trop souvent, revenir en arrière est compliqué, cela plante systématiquement."
"1e4d4083-78ab-4bd1-9e51-71e30ae08cb0","2.5.0","3","2024-05-04 23:32:58","A la fois la meilleur des appli des télé et en même temps ça bug tout le temps. La quantité d'erreur dash existante est tel qu'il est presque impossible de toute les lister. Et malgré ça ça reste mieux que celles des autres fAI. Bref ya pas mieux mais c'est clairement tout le temps en rade quand même ..."
"8599ef74-dea3-496a-bb7d-9202a911fa0c","2.5.0","1","2024-05-04 22:17:02","Depuis plus d'une semaine (si ce n'est plus pour d'autres ), toujours le même problème erreur 1121 que vous deviez corriger depuis un moment... On Attend encore !"
"1a1fd3ba-fd23-4509-92c0-aa63f66e16f0","2.5.0","3","2024-05-04 21:09:32","Ce serait mieux de me guider pour établir une protection de mon système, vous ne pensez pas ?"
"8f4a89be-0881-4153-9ad6-5b1b8f9758e3","2.5.0","4","2024-05-04 19:21:56","Pas encore installée sur mon téléphone portable mais je voudrais bien l'installer sur mon ordinateur portable mais c'est pas évident"
"220d4586-0b80-4015-bfc5-45379d3925d6","2.5.0","5","2024-05-04 12:05:19","Très bien freebox OQEE BY FREE"
"40c81bf5-de64-46b0-86fb-513a25bac9e8","2.5.0","1","2024-05-04 06:36:12","L'application ne fonctionne plus en mode paysage (plein écran). Ce quk est très énervant."
"8c2a7b7c-82dd-4769-81c7-b61089f7492d","2.5.0","5","2024-05-04 05:04:21","très bien construit Bravo"
"0a487aa1-82c6-4912-9124-1a8d1e8d540e","2.5.0","4","2024-05-04 00:19:37","Il faudrait plus D accès a certaine série ou film connu tel que la petite maison dans la prairie,Walker,dallas certain film louis de Funès,Belmondo..."
"39bc1d11-6e32-4a74-b19c-b69c1a97214b","2.5.0","5","2024-05-03 22:37:47","très bonne application"
"14dd9b5d-7cd1-4e7f-b414-1822d0e43050","2.5.0","5","2024-05-03 22:13:37","Mise a jour régulières. Tout est OK pour le moment"
"9918e09e-1bd4-49d0-b602-0f95b99bb4ab","2.5.0","5","2024-05-03 21:22:13","Bonne application la meilleur pour regarder des séries,des film,des déssin animé etc ."
"580d5688-5d19-41df-9541-0841b04a9654","2.5.0","5","2024-05-03 20:13:50","Bien mais très kkkiîuuuùuuj'''kïétroit"
"3fa7fd13-2e74-4c41-80c2-b75ada70ef39","","1","2024-05-03 00:35:42","Avec la dernière version impossible de regarder une chaine en plein écran ! Je suis revenu à la version précédente 2.4.3 !"
"a87be7fa-9e78-41e0-a62c-0b6dee7f07bb","2.5.0","3","2024-05-02 22:09:07","Depuis la mise A jour , les séries et ou film en replay sont en anglais dans le menu impossible de changer, les séries et ou films français on le sous titrage est pareil impossible de decocher l option..."
"e39f9341-1417-4248-9b3d-4cbd864952fe","1.28.2","5","2024-05-02 13:47:28","top et très facile d’utilisation"
"1dfa1723-9ae8-40f3-aff3-1a3b36b85169","2.5.0","1","2024-05-02 08:17:10","Je suis en Australie depuis quelques mois et les programmes ne sont pas compatibles avec ma zone géographique !!! Pourtant me Faire patienter pendant 5 publicités Avant de m'en informer, là c'est compatible. Jai essayé avec plusieurs programmes de différentes sections... A chaque fois je regarde la publicité obligatoire et là,bam 💥 finalement le programme nest pas compatible... Mais la pub si !!! Étrange... Alors que je paye mon abonnement Free mobile... Mince à la fin."
"5976be16-7820-4df2-b1f4-0b669aa1f76c","2.5.0","4","2024-05-02 06:55:34","Presque parfait , a part la pub pour le service video"
"f8e324ea-bd1b-4b1a-b885-a24a9e155c43","2.5.0","5","2024-05-02 00:27:30","Sur application et je vous la conseil que se sois sur le pc ou portable sa marche super bien."
"5dcf9319-89cc-4f46-a183-13f9b0851fc4","","4","2024-05-01 23:46:01","L'application fonctionne avec ma tablette mais ne veut pas se lancer avec mon téléphone depuis quelques jours même en ayant désinstaller et réinstaller l'application. Dernière maj défectueuse ? Ou simple bug ?"
"408d3f60-4a49-4237-a3d9-ee35fcded0b2","","1","2024-05-01 22:14:53","Nul ne fonctionne même application qui ne sert à rien"
"e1125d85-90b4-4226-833b-e44a9e6162cb","2.5.0","2","2024-05-01 22:12:00","Pour la tv en direct impossible de revenir en arrière comme avant la ça ne marche plus du tout avant on pouvait revenir jusqu'à 8h en arrière"
"2762d29b-5b22-4e7a-a981-91e9b97ef9b8","","1","2024-05-01 22:06:16","Toujours un message (error)au beau milieu d'un film c'est récurrent !"
"3f0536fa-bbde-4c29-a08d-e3d9ac0db188","2.5.0","1","2024-05-01 21:45:44","elle ne fonctionne plus depuis plus d'une semaine"
"720c98fd-79e6-4b37-b746-ac6ca02f5a65","2.5.0","5","2024-05-01 21:38:05","Excellente Appl...Merci"
"a23bdeff-e294-4bb6-8c3d-2a6c309a5ec1","2.5.0","5","2024-05-01 20:52:41","Bonne application"
"3275587d-3c1b-4f68-b09c-9e58693b5ba5","2.5.0","1","2024-05-01 15:15:00","Bug sur tablette depuis la dernière mise à jour 🥴"
"2e385c07-e5e6-4c5c-94c0-185152611fd9","2.5.0","5","2024-05-01 13:58:09","Merci Free ;)"
"361a4111-2759-4a4b-9458-ff0b7eb83672","","1","2024-05-01 08:21:39","Nul zéro bidons"
"75e0a058-902a-48c7-a543-be2e11b6f77d","2.5.0","5","2024-05-01 01:07:07","impeccable"
"d98f2526-1e40-49e3-8c18-387dcc31b215","2.5.0","5","2024-04-30 19:46:46","Très pratique lorsque vous n'êtes pas à la maison devant votre télé pour regarder votre émission préférée. Très pratique également pour revenir en arrière et voir le début du film que vous avez manqué."
"9c07a170-66c7-4fe6-8baf-99c0a6930ddd","","1","2024-04-30 18:02:21","Depuis la dernière MAJ, je n'arrive plus à regarder le flux en direct et la bascule en plein écran plante l'appli. Précision : J'ai un flux vidéo/son si je reste sur les chaînes recommandées. Mais si je veux basculer sur mes chaînes favoris, là plus de flux vidéo/son."
"14ede04f-7ad7-4c1a-ba7d-6c5c0eb405a5","2.5.0","1","2024-04-30 08:55:52","Depuis la mise à jour, plus aucun Replay ne ce lance quelque soit la chaîne"
"ee8ae78e-59a2-44c6-a88d-9bebaba3a949","2.5.0","1","2024-04-30 08:08:44","Depuis la dernière mise à jour Sur le portable Erreur #1121 Erreur drm ne fonctionne plus sur le portable"
"b01f79e1-fdd6-4b83-9081-c21136cd8cdb","2.5.0","1","2024-04-30 07:49:34","L'application plante systématiquement lors du passage en mode paysage sur mon smartphone (Erreur Dash #1121)"
"d1cc6a1f-209d-4cd2-8252-14b1c72063be","","1","2024-04-30 06:54:59","J'arrive plus a l'utiliser. Beug 😡😡😡"
"6d9647ee-50bc-4fe1-804a-215dfe501bad","2.5.0","3","2024-04-29 23:44:35","connexion trop lente... difficile de suivre une émission..."
"336d06f4-2808-4b74-91d0-cdcf65af65c1","2.5.0","2","2024-04-29 20:38:18","Tout fonctionnait très bien , sur tous mes supports Android et une mise à jour vous fous tout en l'air. Ras le bol de vos multiples erreur dash ! Je ne sais pas que font les développeurs pour dégrader les choses au lieu de les améliorer 😡"
"042d78e6-534f-4393-bdd7-1a2c6e08fded","2.5.0","1","2024-04-29 19:20:44","Application bug. La video ne se lance pas, surtout si on bascule du mode portrait a paysage. Par contre la video se lance en preview."
"f8636ee1-32a1-4c19-9a45-d39d7f802a2c","2.5.0","5","2024-04-29 18:15:33","Application nickel."
"a89431ba-228b-4c8e-bdcb-4d7955b42193","2.5.0","5","2024-04-29 17:00:48","Merci c'est génial d'avoir la télé sur mon tél . Un grand merci à Free"
"2786ec93-9cb4-4c07-bf06-7742d319e659","2.5.0","5","2024-04-29 13:46:10","very good"
"2843fe8e-5b39-4a6a-a3bf-6049eef64d79","2.5.0","5","2024-04-29 08:32:56","Merci a free pour ce pack TV en plus sur mon abonnement. Appli qui fonctionne très bien sur mon smartphone Android mais pas sur mon TV Stick Amazone hélas."
"bbc27118-3a0d-4335-b581-130800681907","2.5.0","1","2024-04-29 06:54:39","Impossible de regarder quelque soit la chaîne . Gros beug depuis quelques jours ."
"a97f2dc3-1aea-46b9-95b3-b08bb36f6387","2.5.0","5","2024-04-28 23:36:58","super"
"1d5bf31d-39bc-4c1e-b659-ea0658515030","2.5.0","1","2024-04-28 21:46:35","Nouveau gros problème et qui est récurrent sur Android 11 l'application ne peut plus fonctionner "" Erreur#1121"" ""erreur dash erreur DRM"" - J'AI EFFECTUER LES MANIPULATIONS RECOMMANDÉ PAR L' ASSISTANCE.OQEE.TV( FORCÉ LE LANCEMENT L3) SANS EFFET. MERCI DE JETÉ UN OEIL AU CODE DE VOS DERNIÈRES MÀJ IL Y AVAIT EU UNE VRAI PROGRESSION DERNIÈREMENT L'APPLI FONCTIONNÉ TRÈS BIEN ET DEPUIS LE 20 AVRIL J'AI CE PROBLÈME RÉCURRENT. PS: le site oqqe.tv via chrome fonctionne ( sur smartphone )"
"6d91e8ba-0381-4e8f-bcc1-2cfeb3738a00","2.5.0","2","2024-04-28 21:00:25","Des soucis d'affichage video avec une bande horizontale en mode paysage sur une tablette samsung et un déphasage des couleurs depuis cette nouvelle maj... Domage tout fonctionnait trés bien avant."
"df7f25e1-a8b8-4ec2-a832-a83c2d4a6f80","2.4.3","1","2024-04-28 20:23:50","ca fait que sauter !"
"ebfb00bb-6c59-492d-bed8-a596d7260f16","2.5.0","1","2024-04-28 19:47:42","Un enfer! Application pas du tout au point. Sur Chromecast : impossible d'avoir une image, tout est haché et pixelisé, seul les replays fonctionnent correctement. Sur firestick : bloqué sans arrêt !"
"c205ba30-7588-491e-b8b9-57136b7032e8","2.5.0","1","2024-04-28 18:45:03","Depuis la mise à jour, ne fonctionne plus en mode paysage ! Erreur dash. Par contre les pubs, dont on rien à faire, passent très bien en paysage !"
"8897cf4c-043b-4bc1-a934-a4813194a883","2.5.0","4","2024-04-28 17:14:56","super appli pour regarder en déplacement ses programmes en direct ou replay! seul petit hic : ne fonctionne pas sur rétroprojecteur t2max"
"1faa4779-5f9c-4dfc-a70f-2500a85a5cf7","2.5.0","1","2024-04-28 16:41:37","L'application crash en mode paysage si on passe du mode portrait en mode paysage ensuite en retournant la tablette ça fonctionne lol"
"86dd6074-9c83-4bab-84e4-c6650bb1a786","2.5.0","1","2024-04-28 14:21:31","Fait que beuger depuis plusieurs jours"
"959691ad-1183-44b4-94d2-d8b238814b55","2.5.0","1","2024-04-28 14:19:18","Problème DRM qui empêche l'utilisation encore fonctionnelle il y a peu sur Xiaomi MI 9t pro"
"e2d71bc4-52cb-443e-bdc8-e27124993c97","2.5.0","5","2024-04-28 13:00:53","Le top 😇👍 si t'as pas Free, t'as rien compris😁"
"579a2df4-48f0-45cb-b606-567afe5c15cd","1.29.0","5","2024-04-28 10:46:27","Génial rien à redire"
"17ac29c8-4ede-4dc9-8d4a-8d7e78d0f0a0","2.5.0","4","2024-04-27 23:15:25","Des bugs ce soir. La vidéo s'arrête si je mets mon téléphone en horizontal et impossible de reprendre sans fermer l'appli."
"919af1e1-2e29-4b20-b0d1-6a74148116b9","2.5.0","5","2024-04-27 22:56:25","c est super 😊"
"0748f68f-6822-415d-899d-73da77d2bc8e","2.5.0","4","2024-04-27 20:34:46","Ça fonctionne bien, par contre il manque une option répétition pour les enregistrements, je passe d'une vieille 4K à une Ultra, et je régresse dans les fonctionnalités"
"63e0ba35-97c8-46e6-906f-357e6ae24bbf","2.5.0","5","2024-04-27 20:13:08","Pratique"
"e19a1a5a-2220-4731-aae5-73b44328f3a9","2.2.2","1","2024-04-27 16:44:19","J'arrive à regarder certaines chaînes en replay, mais pas toute. Et ce qui me surprend c'est que c'est des chaînes du service public comme FR2, je voulais regarder le complément d'enquêtes sur Gérard Depardieu, et là je reste bloqué sur un écran noir, pareil pour d'autres. C'est vraiment dommage, car sur Arte cela fonctionne et sur d'autres aussi. Et ayant une Freebox Révolution, je trouve cela écœurant de ne pas pouvoir enregistrer sur le disque dur de la Freebox !"
"a40ca57a-a35f-43a4-9db8-94edb448ae9a","2.5.0","1","2024-04-27 12:43:59","Erreur DRM !!! impossible de regarder la télévision !"
"ffc9d36a-f159-45f3-afe4-6da68cb5db36","2.5.0","5","2024-04-27 09:21:35","c'est tip top pour ma part. j'adore. je le conseille"
"63f6db7b-6d19-4081-a526-5ac19aeeb836","2.5.0","2","2024-04-26 21:37:33","Plante souvent !"
"9282d7e3-93eb-49de-895b-e71b8d8bd0a9","","1","2024-04-26 17:41:35","Mettez à jour votre appli. Pas moyen de l'utiliser si on a 2 lignes sur le même compte et que seul la ligne secondaire me permet d'obtenir OQEE. OQEE ne prendra en compte que la ligne principale. Mais j'aurais tout de même la joie de me faire spamer par des emails me disant que je peux utiliser l'appli. Privilégier la qualité plutôt que la quantité, s'il vous plaît."
"3c64fbc4-6ed0-44a1-b23e-7a14afc2b40f","","4","2024-04-26 11:43:17","L'application marchait très bien au début, mais maintenant ça me met erreur Dash et il n'y plus rien qui fonctionne et est vrmt dommage ..."
"6bd682b9-9497-4b53-b87a-a427ae2f0cf5","2.5.0","5","2024-04-25 22:51:08","trop top"
"acce0d7a-1135-4c97-b663-e87946c71d96","2.5.0","1","2024-04-25 21:25:15","Un désastre depuis la dernière mise à jour sur telephone Android, Erreur DRM après 5min d'utilisation. Et après impossible d'ouvrir une autre chaine car l'erreur revient à chaque fois!!!!"
"1db98f8e-f9ed-4a3c-8bcf-9054f8b20b45","2.5.0","1","2024-04-25 20:21:56","Depuis la mise à jour gros veug de connexion"
"b9f1fd33-4151-4af3-ac7b-de7d4c677081","","4","2024-04-25 18:50:53","Super, des films disponibles à toutes heures et gratuitement avec l'abonnement freebox !"
"c3a12a79-3c99-4bd5-9484-6c3cb6ae3726","2.5.0","5","2024-04-25 14:06:21","fonctionne très bien,fluide et suffit largement pour s'informer et autres en déplacements ou quand on en a envie,merci free"
"358f4536-6e98-4a4f-ab8d-4751e2bfeb0a","2.5.0","2","2024-04-25 12:29:23","difficultés de connexion"
"5df2660f-b5e3-4008-8409-4396377bde77","2.5.0","1","2024-04-24 22:58:11","Problème avec le replay qui ne marche pas bien: écran noir et info qui clignote mais la pub marche ( chaine 2)!"
"162e931c-3227-4dbc-8828-1ebfa7fa683f","2.5.0","5","2024-04-24 20:47:17","Super idée, comme toujours chez Free"
"5575366c-b724-445f-9acc-e511b752666c","2.5.0","5","2024-04-24 20:45:05","Ça fonctionne bien, il faudrait juste activer le bouton pour pouvoir le transmettre à la TV. Merci Free, je viens de recevoir le mail pour la TV LG oh je vous aime ❤️❤️❤️ merci"
"5bd7cbfc-9e6b-4893-b442-1baf2601a626","2.4.3","4","2024-04-24 20:31:05","Je souhaiterais vivement que la gestion du son s'effectue depuis l'écran à l'instar de l'application SFR TV, c'est vraiment plus pratique, merci aux développeurs d'en tenir compte."
"81961588-e1a6-4fe7-b922-df9a76150ce3","2.5.0","2","2024-04-24 19:55:54","Samsung A40 ne fonctionne pas très bien c'est toujours en recherche de réseau alors que j'ai une bonne connexion"
"b0f6f23a-545d-4531-8316-0b3c30e52c4a","2.5.0","5","2024-04-24 15:53:29","👏Bravo 💡, pourquoi ? Parceque :un nombre important de chaînes TV et pas des moindres ! C'est mieux que ce que propose ou proposait free avec le foot ;""revoir les buts en léger différé!"
"b8de044b-bfc0-4ecd-a96b-3743a981f1e7","2.5.0","1","2024-04-24 10:11:52","des plantage de lecture malgré l'utilisation de cette application sur différents supports (tv téléphone box..)"
"65830c69-141e-40dc-91aa-09540b0ebe3f","2.4.3","5","2024-04-24 08:30:09","Très bonne application merci"
"ed3ed9af-2aa4-4b53-9ba9-56c543df9a93","2.5.0","3","2024-04-24 06:57:10","Pour les chaînes TV c'est formidable. Par contre, sur la partie Ciné, on n'a pas l'histoire de nos films déjà commencé. Même après un appel, le film reprend au début."
"952b6871-e743-48f1-8fd2-64b3ca3368c9","2.5.0","1","2024-04-23 22:44:29","Car on ne peut pas mettre zéro ne fait que beuger ne peut même pas regarder la télé le dimanche réseau zéro me MoDem pareil doit toujours éteindre et rallumer nul et sans réponse de votre part je partirai et free ne répond même pas a ses abonnés nous les fesons travailler grâce à nous il ont un salaire"
"1f19011b-485a-4506-81ff-d1456edf0f55","","1","2024-04-23 21:47:52","J'ai acheté un ordinateur à un peux de temps et je regarde la télé sur mon ordinateur et la connexion est bonne mais il y a des moments qu'en moins de 10 minutes il y a un message erreur s'affiche sur l'écran et à chaque fois je suis obligé de remettre sur la même chaîne au que l'image reste bloqué dans le même endroit même que j'entends des voix de la chaîne que j'avais choisi pour regardé."
"c6fd47bd-c073-410a-a162-4b099899f01e","2.5.0","5","2024-04-23 21:16:49","Cette appli diffuse 't-elle du contenu en direct ou en temps réel ?"
"680975b6-1a64-40a9-bd1b-150c7112415b","2.3.1","2","2024-04-23 19:51:53","N'arrête pas de planter."
"5875e4cb-eae8-4fc3-b99b-7afd7e3b3fbb","2.5.0","5","2024-04-23 18:35:00","super"
"ed569ede-0a73-469a-b57a-1ef9640f33d7","2.4.3","2","2024-04-23 13:24:11","Se fige fréquemment en wifi"
"e1290f1d-d98f-45d5-8725-929173f6acfc","2.5.0","5","2024-04-23 13:07:25","très bien"
"acab6a5a-04fd-44c4-b222-219111085add","","4","2024-04-23 12:57:55","Excellent, il manque plus que contrôler le direct sur les autres chaînes (NRJ12) et un retour à la chaîne précédente j'ai pas sur ma télécommande snif..."
"3a476435-13ae-423e-9cf8-67832eb8710e","2.5.0","5","2024-04-23 11:03:44","Très bien, acces aux mêmes fonctionnalités que sur la box"
"a9307a54-2063-42c6-a67a-fbf33090dad2","2.5.0","5","2024-04-23 08:27:12","Super"
"27fc52d2-0c50-4162-ad11-676e020148a5","2.4.3","5","2024-04-23 04:47:54","application bien"
"74ed77ee-3a71-4006-a57f-cda055a2853d","2.5.0","5","2024-04-22 22:04:51","Top pour avoir la télé en plus avec Google cast"
"5ec54ab8-e1b5-4c90-a7d1-557bfa4f5024","2.5.0","5","2024-04-22 20:58:20","Bonne application mes pas a jour pour les avant première"
"381da163-45f2-4274-80b1-2f9ef133e5db","2.4.3","5","2024-04-22 20:07:33","superbe application zéro problème"
"ca45b8e2-968a-4bc1-9b06-7d0ee21dbe7d","2.4.3","5","2024-04-22 15:55:04","rien à dire excellent je recommande"
"57d22cbe-dbd9-4572-8544-3a2342495466","2.5.0","5","2024-04-22 14:21:43","Super appli fonctionne très bien juste une petite suggestion si c'est possible la possibilité de verrouiller son profil ?"
"0733e54a-8297-460c-81dd-05cfa23b4c6d","2.4.3","1","2024-04-22 12:31:33","Les directs ne se lancent pas, ecran de chargement infini"
"916c5cb5-e867-4c19-8d87-3a242ce4e3ee","2.4.3","5","2024-04-21 22:57:41","👍"
"8dc2a14f-e851-4dc9-b39e-59d5f1dadca8","2.4.3","2","2024-04-21 22:51:30","l'application se bloque assez souvent malgré les mises à jour"
"272a2dbb-8860-4b92-ba69-bbdaba7082a8","2.4.3","5","2024-04-21 22:14:02","Bien"
"f31ad2db-42f3-40c7-9757-1d8f6f19d07d","2.4.3","1","2024-04-21 19:17:06","Ça rame ça rame ça rame, j utilise en caste et des qu il y a du vent du mauvais temps l appli rame toute les 5min"
"5d8bea15-4cc6-4aeb-8235-ee696f68c74a","2.4.3","1","2024-04-21 09:37:33","L'application ne reconnait pas mes identifiants ou m'indique que mon forfait free 5g ne me permet pas d'avoir accès à ce service! Super, je désinstalle."
"93bcf1c2-cc91-4957-b395-9ee1a5645dda","2.4.3","5","2024-04-21 08:39:17","fonctionnement parfait"
"b1d80396-85d3-4f60-b05e-ab31109746c9","2.4.3","5","2024-04-21 05:51:35","C'est pas mal nvp"
"051497eb-ffef-4743-94a7-fcb86a4d3746","","2","2024-04-21 00:20:11","La tnt sur téléphone super"
"58e6f6fc-ae74-465d-8bf5-ed30b78ccb3a","2.4.3","4","2024-04-20 21:30:22","bien aucun bug"
"a57d37d1-0a42-42dd-b060-aa3b9dacbd4e","2.4.3","4","2024-04-20 18:40:39","👌😉"
"c03894ea-9ef4-450f-b2b5-d5ca81094b36","2.4.3","5","2024-04-20 17:49:43","Excellent !"
